category,text
REAL,Interim Operational Considerations for Implementing the Shielding Approach to Prevent COVID-19 Infections in Humanitarian Settings
REAL,Funeral Guidance for Individuals and Families
REAL,Transcript for CDC Telebriefing on New Resources and Tools to Support Opening Schools
REAL,What Public Health Inspectors Need to Know about COVID-19
REAL,Health Equity
REAL,Health Equity Considerations and Racial and Ethnic Minority Groups
REAL,What We Can Do
REAL,FAQ for School Administrators on Reopening Schools
REAL,Toolkit for People with Disabilities
REAL,Scaling Up Staffing Roles in Case Investigation and Contact Tracing
REAL,"Community, Work, and School"
REAL,"Notes from the Field: Effects of the COVID-19 Response on Tuberculosis Prevention and Control Efforts - United States, March-April 2020"
REAL,"Estimated County-Level Prevalence of Select Underlying Medical Conditions Associated with Increased Risk of Severe COVID-19 Illness - United States, 2018"
REAL,"Estimated Community Seroprevalence of SARS-CoV-2 Antibodies - Two Georgia Counties, April 28-May 3, 2020"
REAL,"Population Point Prevalence of SARS-CoV-2 Infection Based on a Statewide Random Sample - Indiana, April 25-29, 2020"
REAL,"School Decision-Making Tool for Parents, Caregivers, and Guardians"
REAL,The Importance of Reopening America’s Schools this Fall
REAL,FAQs for Medicolegal Death Investigators
REAL,Guidance for Child Care Programs that Remain Open
REAL,Dr. Robert R. Redfield Statement on SARS-CoV-2 infections
REAL,Testing demand keeps CDC lab fellow on the go
REAL,Cleaning and Disinfecting
REAL,Toolkit for Retirement Communities
REAL,Toolkit for Tribal Communities
REAL,Interactive Serology Dashboard for Commercial Laboratory Surveys
REAL,Ways to safely seek care during COVID-19
REAL,Uses of Telehealth during COVID-19 in Low Resource Non-U.S. Settings
REAL,Toolkit for Childcare Programs and Summer Camps
REAL,COVID-19 Serology Surveillance
REAL,"Novel COVID-19 survey takes nation’s social, mental “Pulse”"
REAL,Discontinuation of Isolation for Persons with COVID -19 Not in Healthcare Settings
REAL,Contact Tracing Steps - Infographic
REAL,Toolkit for Colleges and Universities
REAL,Toolkit for Worker Safety & Support
REAL,Toolkit for Parks & Recreational Facilities
REAL,Toolkit for Community and Faith-Based Organizations
REAL,Toolkit for Businesses and Workplaces
REAL,Interim Guidance on Testing Healthcare Personnel for SARS-CoV-2
REAL,Strategies to Mitigate Healthcare Personnel Staffing Shortages
REAL,CDC Director Dr. Robert R. Redfield and HHS Chief Information Officer Jose Arrieta Remarks on HHS Protect
REAL,Cruise ship No Sail Order extended through September 2020
REAL,"Detection and Genetic Characterization of Community-Based SARS-CoV-2 Infections - New York City, March 2020"
REAL,"Symptom Profiles of a Convenience Sample of Patients with COVID-19 - United States, January-April 2020"
REAL,"Factors Associated with Cloth Face Covering Use Among Adults During the COVID-19 Pandemic - United States, April and May 2020"
REAL,"Absence of Apparent Transmission of SARS-CoV-2 from Two Stylists After Exposure at a Hair Salon with a Universal Face Covering Policy - Springfield, Missouri, May 2020"
REAL,"Characteristics of Persons Who Died with Coronavirus Disease 2019 (COVID-19) - United States, February 12-May 18, 2020"
REAL,Optimizing Supply of PPE and Other Equipment during Shortages
REAL,Summary for Healthcare Facilities: ?Strategies for Optimizing the Supply of PPE during Shortages
REAL,Toolkit for Older Adults and People at Higher Risk
REAL,Infographic: Early Cases of MIS-C: Multi-System Inflammatory Syndrome in U.S. Children
REAL,When to wear gloves
REAL,Maintaining Essential Services for Malaria in Low-Resource Countries
REAL,"Every day, I walk away amazed"
REAL,Interim Infection Prevention and Control Recommendations for Healthcare Personnel During the Coronavirus Disease 2019 (COVID-19) Pandemic
REAL,Social Distancing
REAL,Interim Recommendations for Emergency Medical Services (EMS) Systems and 911 Public Safety Answering Points/Emergency Communication Centers (PSAP/ECCs) in the United States During the Coronavirus Disease (COVID-19) Pandemic
REAL,CDC calls on Americans to wear masks to prevent COVID-19 spread
REAL,COVID-19 Graphics and Buttons
REAL,About CDC COVID-19 Data
REAL,Considerations for Non-emergency Vehicle Transportation for Tribal Communities During COVID-19
REAL,Event Planning and COVID-19: Questions and Answers
REAL,Guidance for U.S. Healthcare Facilities about Coronavirus (COVID-19)
REAL,Handwashing
REAL,Guidance for Health Departments about COVID-19 Testing in the Community
REAL,Seroprevalence Surveys in Special Populations
REAL,Toolkit for Youth Sports
REAL,Toolkit for Shared and Congregate Housing
REAL,Toolkit for Domestic Travelers
REAL,Cleaning and Disinfection for Households
REAL,"Race/Ethnicity, Underlying Medical Conditions, Homelessness, and Hospitalization Status of Adult Patients with COVID-19 at an Urban Safety-Net Medical Center - Boston, Massachusetts, 2020"
REAL,"Provision of Pediatric Immunization Services During the COVID-19 Pandemic: an Assessment of Capacity Among Pediatric Immunization Providers Participating in the Vaccines for Children Program - United States, May 2020"
REAL,"Increases in Health-Related Workplace Absenteeism Among Workers in Essential Critical Infrastructure Occupations During the COVID-19 Pandemic - United States, March-April 2020"
REAL,"Update: COVID-19 Among Workers in Meat and Poultry Processing Facilities - United States, April-May 2020"
REAL,"Initial and Repeated Point Prevalence Surveys to Inform SARS-CoV-2 Infection Prevention in 26 Skilled Nursing Facilities - Detroit, Michigan, March-May 2020"
REAL,Getting the word out to protect meat and poultry plant workers
REAL,Recommendations for Tribal Ceremonies and Gatherings During the COVID-19 Outbreak
REAL,What COVID-19 Seroprevalence Surveys Can Tell Us
REAL,CDC in Action
REAL,Multistate Assessment of SARS-CoV-2 Seroprevalence in Blood Donors
REAL,Considerations for Providing Hemodialysis to Patients with Suspected or Confirmed COVID-19 in Acute Care Settings
REAL,About Serology Surveillance
REAL,Social Media Toolkit: Daily Life & Going Out
REAL,"Social Media Toolkit: Communities, Schools & Workplaces"
REAL,COVID-19 Response Highlights
REAL,Social Media Toolkit: Prevent Getting Sick
REAL,Funeral Home Workers
REAL,"COVID-19 Considerations for Animal Activities at Fairs, Shows, and Other Events"
REAL,How to Make Masks
REAL,"Screening for SARS-CoV-2 Infection Within a Psychiatric Hospital and Considerations for Limiting Transmission Within Residential Psychiatric Facilities - Wyoming, 2020"
REAL,"Exposures Before Issuance of Stay-at-Home Orders Among Persons with Laboratory-Confirmed COVID-19 - Colorado, March 2020"
REAL,"Characteristics of Adult Outpatients and Inpatients with COVID-19 - 11 Academic Medical Centers, United States, March-May 2020"
REAL,"Serial Laboratory Testing for SARS-CoV-2 Infection Among Incarcerated and Detained Persons in a Correctional and Detention Facility - Louisiana, April-May 2020"
REAL,"COVID-19 Outbreak Among College Students After a Spring Break Trip to Mexico - Austin, Texas, March 26-April 5, 2020"
REAL,COVID-19 Webinar and Partner Calls Videos
REAL,Changing Paths During the Pandemic
REAL,Covid-19 Videos
REAL,Visiting Beaches and Pools
REAL,Studying the disease
REAL,Monitoring and tracking the disease
REAL,Identifying the source of the outbreak
REAL,Developing Guidance to Protect the Public’s Health
REAL,About COVID-19 Epidemiology
REAL,Support For Teens and Young Adults
REAL,Helping Children Cope
REAL,Coping with Stress
REAL,"Higher education is one of America's strongest export sectors. Over 1 million international students studied at American universities, (in the) 2018-19 school year. They contributed over $40 billion to the economy."
REAL,"Taxpayers spent $70,000,000 to develop this drug ( remdesivir)."
REAL,"Says 1 in 5 Texans did not have health insurance coverage before the pandemic, and now “nearly 1 in 3 Texans under the age of 65 don’t have access to health care insurance.”"
REAL,Says the U.S. Senate is “dominated by millionaires” and that he is “not one of them.”
REAL,The CDC tried to develop clear guidelines about what the stages of re-opening should look like — the administration delayed and scaled them back.
REAL,Federal aid for state and local governments through a proposed coronavirus relief bill would amount to “half of what the Republicans put onto the national debt.”
REAL,"New Zealand let health experts” rather than politicians make decisions about how to deal with COVID-19, “and as of today they have zero COVID cases."
REAL,"Kids are less likely to get it (COVID-19). You know, they’re less likely to spread. So I think there’s some pretty good data out there that will help alleviate some of the concerns."
REAL,Says Joe Biden has said 150 million Americans died from guns and another 120 million from COVID-19
REAL,"Say Wisconsin Republican lawmakers have done nothing ""while neighboring states like Minnesota, Illinois and Michigan have already implemented safety precautions like requiring individuals to wear masks."""
REAL,Five veterinary labs have their CLIA certification to officially test human patients. There are a lot of labs who are doing surveillance testing that don't need the CLIA certification.
REAL,"There have been five randomized controlled, placebo controlled trials that do not show any benefit to hydroxychloroquine."
REAL,There’s a “direct correlation” between North Carolina’s mask requirement and COVID-19 stabilization.
REAL,"If the vaccine came out tomorrow, how in the heck would we get it to people? There is no game plan."
REAL,The United States is “the only major industrial economy to have its unemployment rate triple” since the coronavirus pandemic began.
REAL,"In West Virginia alone, overdoses have increased by 50% during the #COVID-19 pandemic."
REAL,"The fact is that in terms of the risk to schoolkids, this is lower risk than seasonal influenza."
REAL,"In April, when asked how he would handle the COVID-19 pandemic, Tommy Tuberville ""said he didn't have a clue"" and after winning the Republican nomination in July, ""he still said he didn't have a clue."""
