category,text
REAL,What We Can Learn from the Resurgence of COVID-19 in Spain
REAL,Why Approving a COVID-19 Vaccine Too Early Could Cause More Harm Than Good
REAL,"Not Sure You Have COVID-19? Here Are the Symptoms for Coronavirus, Flu, and Allergies"
REAL,Flu Study Highlights Difficulty of Achieving COVID-19 'Herd Immunity'
REAL,Resign or Return? The Dilemma Facing Classroom Teachers in Our COVID-19 Era
REAL,FDA Approves $5 COVID-19 Test That Gives Results in 15 Minutes
REAL,Staying 6 Feet Apart Often Isn’t Enough During COVID-19 Pandemic
REAL,"Despite New Safety Guidelines, Experts Say Movie Theaters Are High-Risk"
REAL,"Yes, You Can Get COVID-19 Again: What to Know"
REAL,"Blood Thinners, Blood Pressure Meds May Improve COVID-19 Survival Rate"
REAL,Fast Isn’t Always Better: What to Know About Rise of Rapid Coronavirus Testing
REAL,"CDC Changes COVID-19 Testing Guidelines, Worrying Experts"
REAL,What to Do When You Clash with Your Kid’s Grandparents About COVID-19
REAL,How to Safely Sanitize Every Type of Face Mask
REAL,Suicidal Ideation Is Increasing During COVID-19: How Best to Cope
REAL,‘Secondary Victims’: Families of People Who Died from COVID-19 Talk About Their Anguish
REAL,COVID-19 Survivors Are Losing Their Hair — Here’s Why
REAL,Why Shrinking Your Social Bubble May Be Necessary Right Now
REAL,What You Need to Know If You Plan to Fly on an Airplane During COVID-19
REAL,Peaches Suspected in Salmonella Outbreak in 9 States: What to Know
REAL,Is It Too Early to Get the Flu Vaccine?
REAL,Here’s Why Seasonal Flu Vaccines Only Last a Few Months
REAL,Woman Who Spoke at DNC Convention Talks to Healthline About Her Father’s COVID-19 Death
REAL,New COVID-19 Saliva Tests Now Available: Are They the Breakthrough We Need?
REAL,COVID-19 Symptoms Usually Show Up in This Order
REAL,How a Housing Crisis Could Make COVID-19 Even Worse
REAL,"Can the New Coronavirus Be Transmitted by Frozen Foods? Unlikely, Experts Say"
REAL,How a Biden-Harris Administration Would Handle the COVID-19 Pandemic Differently
REAL,Psychologist Talks to Healthline About Mental Strain of COVID-19
REAL,"Dr. Anthony Fauci Talks to Healthline About COVID-19 Vaccines, School Safety"
REAL,Cooking at Home More During COVID-19? What to Know About Food Safety
REAL,Can Secondhand Smoke Transmit the Novel Coronavirus?
REAL,NYC COVID-19 Deaths During Peak Rivaled 1918 Flu Fatalities
REAL,COVID-19 Racing Through Nursing Homes: What Families Can Do
REAL,"Neck Gaiters Are Stylish, But How Effective Are They in Stopping COVID-19 Spread?"
REAL,Pregnancy Plans Being Put on Hold During the COVID-19 Pandemic
REAL,Raising a Newborn When Your Office Is an ER
REAL,People Caring for Grandchildren Face High Risks During COVID-19 Pandemic
REAL,A Physician on the Front Lines Talks About Treating Patients and Getting COVID-19
REAL,What’s the Risk of Attending a Public Gathering in Your County? New COVID-19 Tracker Can Help
REAL,How Obesity and Other Conditions Could Hinder the Effectiveness of a COVID-19 Vaccine
REAL,Kids’ Vaccination Rates Have Plummeted — Here’s What That Means for the Fall
REAL,Michelle Obama Talks ‘Low-Grade Depression’ During the Pandemic
REAL,Russia Claims They Have a COVID-19 Vaccine: Why You Should Be Skeptical
REAL,Why the Heart Attack Death Rate Has Doubled During COVID-19
REAL,How Much Will You Pay for a COVID-19 Vaccine? Here’s What We Know
REAL,Animal Laboratories Being Used to Process COVID-19 Tests in an Effort to Speed Up Results
REAL,How Schools Can Easily Become ‘Superspreaders’ of COVID-19
REAL,How Telemedicine Can Help People Access Birth Control During the Pandemic
REAL,Here’s What Happened the Last Time We Had a Vaccine During a Pandemic
REAL,People Without Symptoms Carry Just as Much of the Coronavirus as Symptomatic People
REAL,Here’s What We Know About the Demographic Makeup of the COVID-19 Vaccine Trials
REAL,"For Homemade Face Masks, 3 Layers Are Better Than 1"
REAL,Are Massages and Acupuncture Treatments Safe During COVID-19?
REAL,There’s More Evidence That Black Americans Face High Risks from COVID-19
REAL,Europe Sees Rise in COVID-19 After Reopening
REAL,How People at Higher Risk from COVID-19 Can Enjoy Summer Safely
REAL,How Lockdowns Have Helped Improve Some Mother-Daughter Relationships
REAL,Do You Need to Wear Goggles to Stay Safe from COVID-19?
REAL,What You Can Do If There’s a Shortage of Disinfectants in Your Area
REAL,Restarting Professional Sports Is Putting Players at Risk and Sending the Wrong Message to the Public
REAL,How the Coronavirus Spreads Indoors and What Can Be Done About It
REAL,Why Most People Will Have to Wait Months to Get a COVID-19 Vaccine After It’s Available
REAL,The Simple Science Behind Why Masks Work
REAL,From Toddlers to Teens: How to Talk to Kids About Wearing Masks
REAL,People Who Wear COVID-19 Masks Touch Their Faces Less — That’s a Good Thing
REAL,Why Herman Cain’s Death Hasn’t Changed People’s Perspective on COVID-19
REAL,Dr. Anthony Fauci Talks COVID-19 Vaccine and School Openings
REAL,How Pooled Testing Can Help Us Fight Spread of COVID-19
REAL,Rural America Could Be the Region Hardest Hit by the COVID-19 Outbreak
REAL,COVID-19 Is Likely to Be the Third-Leading Cause of Death in the U.S. This Year
REAL,The Safe and Unsafe Ways People Are Worshipping During COVID-19
REAL,"Yes, the Government and Your Employer Can Make You Get a COVID-19 Vaccine"
REAL,COVID-19 Damaged Heart of Elite Athlete: What Does That Mean for the Rest of Us?
REAL,How Screen Time May Be Contributing to Dry Eye During the Pandemic
REAL,Researchers ID 6 COVID-19 Symptom Sets: How That Will Help High-Risk Patients
REAL,How and When Children Should Return to Sports During COVID-19
REAL,Many Early Vaccine Trials Show Promise. Most Still Fail. Here’s Why
REAL,COVID-19 Survivors Share How to Recover During Pandemic
REAL,Medical Experts Say We Need a Second Shutdown to Control COVID-19
REAL,New Research Finds Kids Just as Likely as Adults to Spread COVID-19
REAL,"Estrogen and COVID-19: How Pregnancy, Birth Control Can Increase Risk of Blood Clots"
REAL,Many COVID-19 Patients Will Need Rehab Long After Infection Is Over
REAL,Experts Say It’s Safe to Breastfeed During the COVID-19 Pandemic
REAL,You Probably Can’t Get COVID-19 Twice: The Latest on Antibodies
REAL,FDA Expands List of Hand Sanitizers That Contain Toxic Methanol
REAL,Walgreens to Open Doctor Offices: What This Means for Your Healthcare Services
REAL,COVID-19: How California Went from Model State to Hot Spot
REAL,"Lip Reading, Facial Expressions: How Masks Make Life Harder for People with Hearing Difficulties"
REAL,What Parents Should Know About the CDC’s Guidelines for Reopening Schools
REAL,Extensive Study Determines Vaccines Are ‘Remarkably Safe’
REAL,There’s a Difference Between Quarantine and Isolation: What You Should Know
REAL,I Tested Negative for COVID-19 — It Took 13 Days to Get the Results
REAL,‘Doomscrolling’ During COVID-19: What It Does to You and How You Can Avoid It
REAL,How COVID-19 Outbreaks in Prisons Are Making the Pandemic Worse for Everyone
REAL,Can You Have a Second Wave of COVID-19 If the First Never Ended?
REAL,How Businesses Requiring Masks Protects Workers and You from COVID-19
REAL,Could Florida’s COVID-19 Surge Get Even Worse? Here’s What Experts Think
REAL,Back on the Front Line: Some Doctors Face COVID-19 a Second Time
REAL,Why Reopening Schools Isn’t as Easy as Reopening Walmart
REAL,Want to Sign Up for a COVID-19 Vaccine Trial? Here’s What to Know
REAL,You Now Have to Wait More Than a Week for COVID-19 Test Results — And Why It May Get Worse
REAL,"If 50% of People Take These 3 Simple Steps, We Might Be Able to Stop the Spread of COVID-19"
REAL,Why the Pandemic Is Probably Messing with Your Sense of Time
REAL,3 More COVID-19 Vaccines Move Toward Final Stage of Testing
REAL,How New York City Got Control of COVID-19 — and Where It Goes from Here
REAL,When Is It Safe to Be Around Someone Who’s Recovered from COVID-19?
REAL,"Antiseptic From the 1950s May Be Effective in Fighting Coronavirus, Flu, HPV"
REAL,Rare Heart Condition Linked to Stress May Be Increasing During COVID-19 Pandemic
REAL,COVID-19 Antibodies May Fade Quickly. What this Means for Herd Immunity
REAL,COVID-19 Mortality Is Going Down in ICUs — What This Means for the Pandemic
REAL,What Life Is Like for a Florida ER Physician During the COVID-19 Pandemic
REAL,"Cases, Deaths, Hospitalizations: How to Make Sense of COVID-19 Stats"
REAL,Fauci Warns About ‘Post-Viral’ Syndrome After COVID-19
REAL,"Yes, We’re Still in the First Wave of COVID-19. Here Are the Facts"
REAL,COVID-19 Outcomes No Worse for Those Living with HIV
REAL,Why We May Run into PPE Shortages Again
REAL,What It’s Like to Have a ‘Mild’ Case of COVID-19
REAL,Smoking Puts 1 in 3 Young Adults at High Risk for Severe COVID-19
REAL,It’s Too Early to Know If Moderna’s COVID-19 Vaccine Will Work After Initial Tests
REAL,Hospitals Put to Test as COVID-19 Strains ICUs
REAL,Here’s What It Will Take to Normalize Wearing Masks in America
REAL,"We’re Nowhere Near Herd Immunity with COVID-19, Experts Say"
REAL,CDC Expands List of Those with Higher COVID-19 Risks: What to Know
REAL,Natural Disasters Won’t Stop Just Because There’s a Pandemic: How We Can Be Prepared
REAL,How a Mask Fits Can Be as Important as What It’s Made Of
REAL,What Experts Think About Reopening Schools
REAL,What to Expect If a COVID-19 Contact Tracer Calls You
REAL,Here’s What to Know About the COVID-19 Mortality Rate as Cases Climb
REAL,This New COVID-19 Tracker Can Help You Better Understand Your Local Risk
REAL,What a Lack of COVID-19 Testing Means for Children and Reopening Schools
REAL,"COVID-19 Linked to Major Neurological Conditions Including Stroke, Brain Swelling"
REAL,Lysol Disinfectant Approved for Use Against COVID-19: Here’s What Else Can Work
REAL,Even Asymptomatic People Can Spread COVID-19 Within a Room
REAL,U.S. May Be Headed for a ‘Full-Blown’ COVID-19 Outbreak: How to Prepare
REAL,Why the Black Lives Matter Protests Didn’t Contribute to the COVID-19 Surge
REAL,How Accurate Are COVID-19 Diagnostic and Antibody Tests?
REAL,"She Had a Stroke, Then the Pandemic Hit. Here’s How She Fought to Recover"
REAL,How to Create Your ‘Social Bubble’ and Interact Safely This Summer
REAL,Why You Might Want to Think Twice Before Making Your Own Hand Sanitizer
REAL,How to Tell If the Hand Sanitizer You’re Buying Is Safe and Actually Works
REAL,On the COVID-19 Front Line: What It’s Like in Hospitals in Texas and Arizona Now
REAL,Why Hanging Out at a Bar During the Pandemic Is a Terrible Idea
REAL,How to Enjoy the Fourth of July Weekend Amid the COVID-19 Resurgence
REAL,Feds Warn That Face Mask ‘Exemption’ Cards Are Fake
REAL,"COVID-19 Vaccines Are Moving Fast, but Will Americans Agree to Get Them?"
REAL,Nasal Vaccine Against COVID-19 Prevents Infection in Mice
REAL,Inconsistencies in Data Presentation Could Harm Efforts Against COVID-19
REAL,Coronavirus SARS-CoV-2 Spreads More Indoors at Low Humidity
REAL,COVID-19: How South Korea Prevailed While the United States Failed
REAL,"Low-Cost, Accurate COVID-19 Antibody Detection Platform"
REAL,"Airborne Viruses Can Spread on Dust, Non-Respiratory Particles"
REAL,Social Distancing Decreased Pediatric Respiratory Tract Infections in Finland
REAL,Scientists Identify the Order of COVID-19's Symptoms
REAL,Experimental COVID-19 Vaccine Prevents Severe Disease in Mice
REAL,"Bouncing, Sticking, Exploding Viruses: Understanding the Surface Chemistry of SARS-CoV-2"
REAL,"Masks, PPE Materials Should Be Hydrophilic"
REAL,"COVID-19 Should Be Treated as an Acute Inflammatory Disease, Scientist Suggests"
REAL,Taste Bud Cells Might Not Be a Target of SARS-CoV-2
REAL,Exposure to Common Cold Coronaviruses Can Teach the Immune System to Recognize SARS-CoV-2
REAL,The Six Strains of SARS-CoV-2
REAL,Immune System Variation Can Predict Severe COVID-19 Outcomes
REAL,Tracking Antibody Profiles for Influenza Exposures Across the Lifespan
REAL,Lab-Made Virus Mimics COVID-19 Virus
REAL,Vaccine Additives Can Enhance Immune Flexibility -- Implications for Flu and SARS-CoV-2
REAL,"Obesity and Metabolic Syndrome Are Risk Factors for Severe Influenza, COVID-19"
REAL,Common FDA-Approved Drug May Effectively Neutralize Virus That Causes COVID-19
REAL,CT of Coronavirus Disease (COVID-19) Versus CT of Influenza Virus Pneumonia
REAL,Contracting COVID-19: Lifestyle and Social Connections May Play a Role
REAL,"About Half of Health Care Workers Positive for COVID-19 by Serology Have No Symptoms, Study Finds"
REAL,Flu in Early Life Determines Our Susceptibility to Future Infections
REAL,Controlled Human Infection Models and SARS-CoV-2 Vaccine Development
REAL,Antibody Blockade Effective in Treatment of Severe COVID-19
REAL,Beating HIV and COVID-19 May Depend on Tweaking Vaccine Molecules
REAL,Antiviral Used to Treat Cat Coronavirus Also Works Against SARS-CoV-2
REAL,How Genetics Could Impact COVID-19 Treatments
REAL,Too Many COVID-19 Patients Get Unneeded 'Just in Case' Antibiotics
REAL,Treating COVID-19 Could Lead to Increased Antimicrobial Resistance
REAL,"Mother Transmitted COVID-19 to Baby During Pregnancy, Physicians Report"
REAL,Researchers Show Children Are Silent Spreaders of Virus That Causes COVID-19
REAL,Mild COVID-19 Cases Can Produce Strong T Cell Response
REAL,Is COVID-19 Transmitted Through Breast Milk? Study Suggests Not Likely
REAL,Researchers Identify a Protein That May Help SARS-CoV-2 Spread Rapidly Through Cells
REAL,Pasteurization Inactivates COVID-19 Virus in Human Milk: New Research
REAL,Malaria Discovery Could Expedite Antiviral Treatment for COVID-19
REAL,"Mouthwashes Could Reduce the Risk of Coronavirus Transmission, Study Shows"
REAL,COVID-19 Vaccine Shows Promise in Mouse Studies
REAL,Researchers Develop New Mouse Model for SARS-CoV-2
REAL,Decoy Receptor Neutralizes Coronavirus in Cell Cultures
REAL,Re-Engineering Antibodies for COVID-19
REAL,National Academies Publishes Guide to Help Public Officials Make Sense of COVID-19 Data
REAL,"Young Kids Could Spread COVID-19 as Much as Older Children and Adults, Study Suggests"
REAL,Rapid Test for the Determination of Antibodies Against Sars-Cov-2
REAL,COVID-19 Research: Anti-Viral Strategy With Double Effect
REAL,Experimental COVID-19 Vaccine Protects Upper and Lower Airways in Nonhuman Primates
REAL,"Combating a Pandemic Is 500 Times More Expensive Than Preventing One, Research Suggests"
REAL,Immunoprotein Impairs SARS-CoV-2
REAL,"Face Coverings Do Not Lead to False Sense of Security, Existing Evidence Suggests"
REAL,Rapid COVID-19 Test Developed to Detect Neutralizing Antibodies With High Specificity and Sensitivity
REAL,Neutralizing Antibodies Isolated from COVID-19 Patients May Suppress Virus
REAL,Coronavirus Antibodies Fall Dramatically in First 3 Months After Mild Cases of COVID-19
REAL,"Benefits of Routine Childhood Vaccines Far Outweigh Risks of Additional COVID-19 Transmission in Africa, Study Suggests"
REAL,Type 1 Interferon Deficiency: Biomarker of Patients at Risk of Severe COVID-19
REAL,Scientists Uncover SARS-CoV-2-Specific T Cell Immunity in Recovered COVID-19 and SARS Patients
REAL,COVID-19: Patients Improve After Immune-Suppressant Treatment
REAL,Novel Test Method Detects Coronavirus in Highly Diluted Gargle Samples
REAL,"COVID-19 Can Be Transmitted in the Womb, Reports Pediatric Infectious Disease Journal"
REAL,Why Lopinavir and Hydroxychloroquine Do Not Work on COVID-19
REAL,New Study Supports Remdesivir as COVID-19 Treatment
REAL,Global Wildlife Surveillance Could Provide Early Warning for Next Pandemic
REAL,"Older, Critically Ill Patients With COVID-19 May Have Increased Risk of Bradycardia With Lopinavir and Ritonavir"
REAL,Compounds Halt SARS-CoV-2 Replication by Targeting Key Viral Enzyme
REAL,Newer Variant of COVID-19-Causing Virus Dominates Global Infections
REAL,Blood Clots and Lung Injuries Found in Patients Who Have Died of COVID-19
REAL,Dilated Blood Vessels in the Lung May Explain Low Oxygen Levels in Severe Cases of COVID-19
REAL,Team Creates Better Tool to Aid COVID-19 Diagnosis
REAL,COVID-19: The Virus and the Vasculature
REAL,"Lung Ultrasound Shows Duration, Severity of Coronavirus Disease (COVID-19)"
REAL,Phase 3 Clinical Testing in the US of AstraZeneca COVID-19 Vaccine Candidate Begins
REAL,People with intellectual and developmental disabilities disproportionately affected by COVID-19
REAL,NIH establishes Centers for Research in Emerging Infectious Diseases
REAL,Clinical trials of monoclonal antibodies to prevent COVID-19 now enrolling
REAL,NIH clinical trial testing remdesivir plus interferon beta-1a for COVID-19 treatment begins
REAL,"NIH harnesses AI for COVID-19 diagnosis, treatment, and monitoring"
REAL,NIH-Moderna investigational COVID-19 vaccine shows promise in mouse studies
REAL,NIH clinical trial to test antibodies and other experimental therapeutics for mild and moderate COVID-19
REAL,NIH launches clinical trial to test antibody treatment in hospitalized COVID-19 patients
REAL,NIH delivering new COVID-19 testing technologies to meet U.S. demand
REAL,Experimental COVID-19 vaccine protects upper and lower airways in nonhuman primates
REAL,Phase 3 clinical trial of investigational vaccine for COVID-19 begins
REAL,NIH leadership details unprecedented initiative to ramp up testing technologies for COVID-19
REAL,"Experimental COVID-19 vaccine safe, generates immune response"
REAL,Placenta lacks major molecules used by SARS-CoV-2 virus to cause infection
REAL,NIH launches clinical trials network to test COVID-19 vaccines and other prevention tools
REAL,NIH ACTIV vaccine working group weighs role of human challenge studies for SARS-CoV-2 vaccine development
REAL,Another existing drug shows promise against COVID-19
REAL,Scientists discover COVID-19 symptoms appear in a specific
REAL,5 new scientific advances that offer hope against COVID-19
REAL,Is SARS-CoV-2 more dangerous because it reduces specific
REAL,COVID-19 could directly affect the heart
REAL,Synthetic antibody could prevent and treat COVID-19
REAL,COVID-19: Over 80% of young people may show no symptoms
REAL,Even mild COVID-19 may produce long lasting immunity
REAL,Anxiety symptoms vs. COVID-19 (coronavirus) symptoms
REAL,How does weather affect COVID-19?
REAL,COVID-19: What can we learn from South Korea's response?
REAL,Scientists revise COVID-19 incubation period to 7.7 days
REAL,COVID-19 outbreak at a kids' summer camp may be stark
REAL,COVID-19 vaccine successfully protects macaques against virus
REAL,COVID-19: Modified protein may help 'speed up vaccine
REAL,COVID-19: Doctors round up evidence of damage outside the
REAL,New antivirals kill SARS-CoV-2
REAL,"Antibodies fight off the new coronavirus, but what do T cells do?"
REAL,Rare mutations reveal more about COVID-19 and the immune
REAL,"Treating COVID-19: Bipolar drug shows promise, other"
REAL,"New, more infectious SARS-CoV-2 variant does not cause"
REAL,COVID-19: Children may have a higher viral load than adults
REAL,Have we underestimated the pandemic's death toll?
REAL,Claims that high altitudes protect against COVID-19 'speculative'
REAL,COVID-19: Seaweed extract may be more effective than
REAL,COVID-19: Nasal vaccine shows promise in mouse study
REAL,Oxford COVID-19 vaccine shows real promise
REAL,Nitric oxide may be an effective treatment for COVID-19
REAL,COVID-19: Possible mechanism for blood clotting identified
REAL,Antibody cocktail shows promise in fight against the novel
REAL,List of promising drugs against COVID-19 leads to new
REAL,"Children not a major source of COVID-19, finds rapid review"
REAL,"Nonwhite patients more likely to have severe COVID-19, study"
REAL,What are the neurological complications of COVID-19?
REAL,Hopeful COVID-19 research: Testing new vaccines
REAL,Two COVID-19 vaccines show promise in hopeful clinical trials
REAL,High BMI linked to COVID-19 severity in African Americans
REAL,Research associates COVID-19 with spike in 'broken heart
REAL,COVID-19 and face masks: 4 common myths
REAL,Link found between metabolic syndrome and worse COVID
REAL,Shifting goalposts: Research in the time of the coronavirus
REAL,COVID-19 vaccine is safe and triggers immune response in
REAL,COVID-19: How a new blood test could help speed up vaccine
REAL,COVID-19 disruptions could lead to surge in infectious
REAL,Hydroxychloroquine fails to reduce COVID-19 symptoms
REAL,Could zinc protect against COVID-19?
REAL,Experimental study demonstrates remdesivir action against
REAL,COVID-19: How do we explain 'happy' hypoxemia?
REAL,"COVID-19: Linking loss of smell, depression, and anxiety"
REAL,Treating COVID-19 may increase antibiotic resistance
REAL,'No evidence' that vitamin D can prevent or treat COVID-19
REAL,What was the impact of Sweden's soft approach to lockdown?
REAL,Work absences suggest higher-than-reported COVID-19 cases
REAL,How has COVID-19 affected suicidality in the US?
REAL,Tool to help manage COVID-19 patients with diabetes
REAL,MMR vaccine could prevent worst symptoms of COVID-19
REAL,Delaying COVID-19 emergency measures linked to higher
REAL,Editorial highlights flaws in reporting COVID-19 research
REAL,COVID-19 liver damage may be more common than
REAL,Drug that calms 'cytokine storm' may reduce COVID-19 mortality
REAL,Innovative air filter could effectively kill SARS-CoV-2
REAL,Experimental SARS-CoV-2 test works in 45 minutes
REAL,Racial minorities experience higher COVID-19-related
REAL,Stroke risk higher for COVID-19 patients who smoke or vape
REAL,Social distancing and gatherings: Advice and tips
REAL,COVID-19 cases 5 times higher in prisons than general
REAL,Severe COVID-19: Interleukin-6 inhibitors may be most effective
REAL,COVID-19: Dr. Fauci quizzed at Healthline Town Hall meeting
REAL,Mental health effects of COVID-19 revealed in new study
REAL,Blood pressure drugs may improve COVID-19 survival
REAL,How is the world faring 4 months into the pandemic?
REAL,How and why the coronavirus pandemic has changed our
REAL,Researchers call out lack of diversity in COVID-19 clinical trials
REAL,The effects of COVID-19 on the mental health of Indigenous
REAL,COVID-19 and the surge in anti-Asian hate crimes
REAL,Mandatory BCG vaccination may slow spread of COVID-19
REAL,Preventing a pandemic is 500 times cheaper than responding
REAL,Does hydroxychloroquine cut COVID-19 mortality? Expert
REAL,Will COVID-19 and Black Lives Matter change science and
REAL,COVID-19 shows weak points in global food system
REAL,Hydroxychloroquine: When medicine and politics clash
REAL,Respiratory viruses may spread via airborne dust
REAL,The Recovery Room: News beyond the pandemic
REAL,Which homemade masks are most effective?
REAL,Dry heat can effectively sanitize N95 masks
REAL,Scientists propose cheap and accessible test for mask
REAL,"Nose burning: Causes, treatments, and how to stop it"
REAL,Social distancing at work: Advice and tips
REAL,Plague in Inner Mongolia: Should we be concerned?
REAL,"Summer flu: Symptoms, treatments, and home remedies"
REAL,Vaccine misinformation can be dispelled by conversation
REAL,Vomiting and diarrhea with stomach pain: 11 causes and
REAL,"Plaquenil: Dosage, side effects, use for COVID-19, and more"
REAL,Raw milk may harbor antibiotic resistant germs
REAL,"Online searches for ‘chest pain’ rise, emergency visits for heart attack drop amid COVID"
REAL,"Convalescent plasma associated with reduced COVID-19 mortality in 35,000-plus hospitalized patients"
REAL,"The effects of COVID-19 on emergency visits, hospitalizations"
REAL,"COVID-19 testing sites in Rochester to converge on July 13, 2020"
REAL,Mayo Clinic COVID-19 skill for Amazon’s Alexa now available in Canada
REAL,Clorox and Cleveland Clinic Release Guide to Help People Stay Safer at Home During COVID-19
REAL,"Cleveland, Clinic, American Lung Association Provide Advanced COVID-19 Resources for Healthcare Providers"
REAL,"Take Steps to Protect Ourselves, Our Families and Our Community from Coronavirus"
REAL,Clorox and Cleveland Clinic Partner to Address Public Health Needs Posed by COVID-19
REAL,Cleveland Clinic Researchers Identify Genetic Factors that May Influence COVID-19 Susceptibility
REAL,Cleveland Clinic Researchers Find Rise In Broken Heart Syndrome During COVID-19 Pandemic
REAL,Fewer Severe Asthma Attacks In Kids During COVID
REAL,COVID & Social Distancing: Is 6 Feet Enough?
REAL,Hospitals Must Report COVID Data or Be Penalized
REAL,Texas Mother Transmitted COVID-19 to Unborn Baby
REAL,FDA Approves New Rapid Coronavirus Test
REAL,CDC's New COVID Testing Guidelines Trigger Concern
REAL,American Girl Honors Front-Line Heroes
REAL,The Forgotten Science Behind Face Masks
REAL,Women May be Less Susceptible to COVID Than Men
REAL,Study Finds Some COVID-19 Symptoms Last for Months
REAL,CDC Advises Not to Argue With Anti-Maskers
REAL,Olympic Gold Medalist Usain Bolt Tests Positive
REAL,Survivors' Plasma Still OK for Treating COVID-19
REAL,What If Many Americans Say No to a COVID Vaccine?
REAL,FDA Chief Apologizes for COVID Treatment Claim
REAL,Distributing COVID Vaccine Will Be Major Challenge
REAL,Study Confirms It’s Possible to Catch COVID Twice
REAL,What to Know About COVID Contact Tracing and Scams
REAL,BP Meds Could Improve Survival in COVID Patients
REAL,Flushing a Public Toilet? Be Sure to Wear a Mask
REAL,Cases Spiking in Some Southern Universities
REAL,Fauci Says Vaccine Might Be Ready By Late 2020
REAL,KY Reports Record-High Weekly COVID-19 Cases
REAL,FDA Expands Use of Remdesivir for COVID-19 Treatment
