category,text
REAL,COMMENTARY: Prioritizing Ambulatory Gynecology Care During COVID-19: The Latest Guidance
REAL,COVID-19: Are Acute Stroke Patients Avoiding Emergency Care?
REAL,"COVID-19 Daily: Hydroxychloroquine 'Concerns,' Financial Aid Request"
REAL,COVID-19 Practical Tips: U.S. Docs Share Clinical Strategies
REAL,Lessons From the HIV Epidemic for the COVID-19 Pandemic
REAL,COMMENTARY: AMSA President: COVID-19 Shouldn't Sideline Med Students
REAL,Nephrologists on Lessons Learned With Kidney Disease in COVID-19
REAL,"COMMENTARY: Heroes From a Distance, 'Lepers' Up Close?"
REAL,COVID-19 Hitting Some African American Communities Harder
REAL,Potential COVID-19 Plateau Seen in NY and NJ
REAL,Trump Won?t Socially Distance Himself From Pence
REAL,School Closures May Be Adding to Kids' Waistlines
REAL,"China's Controls May Have Headed Off 700,000 COVID-19 Cases: Study"
REAL,Side Effects Halt Use of Chloroquine Vs. COVID-19
REAL,Parasite Drug Shows Early Promise Against COVID-19
REAL,Little Boy With Cystic Fibrosis Beats Coronavirus
REAL,"COVID-19 Daily: Hospitals Struggle, Revisiting Vent Protocols"
REAL,COMMENTARY: A Neurologist Over 60 Looks at COVID-19
REAL,COVID-19 Linked to Multiple Cardiovascular Presentations
REAL,"COVID-19 Exposes Potential Gaps in PPE Training, Effectiveness"
REAL,Not All Biologics Compromise the Immune System
REAL,Stay on Angiotensin Drugs' Still the Message as Trials Begin
REAL,Surgeon General: This Week Is ?Our Pearl Harbor'
REAL,British PM Admitted to Hospital for COVID-19
REAL,Trump: Toughest COVID-19 Weeks To Come
REAL,Medical Societies Issue Bold Statement of Physician Support
REAL,Mother-Baby Separation for COVID-19 Not Evidence-Based
REAL,"COVID-19 Daily: Ventilator Protocols Questioned, Physician Rights"
REAL,"Neurologic Symptoms and COVID-19: What's Known, What Isn't"
REAL,"Coronavirus Is Aerosolized Through Talking, Exhalation"
REAL,"COVID-19 Daily: More Will Die, First Antibody Test Authorized"
REAL,Huge Global Effort for Clinical Trials in COVID-19
REAL,"Doctor With COVID-19 Recovering After Treatment, ""Lot of Luck"
REAL,Silence Over Safety? Muzzling Clinicians a Public Health Issue
REAL,AHA COVID-19 CVD Registry to Collect Data on CV Outcomes
REAL,Medicaid Nearing ?Eye Of The Storm? As Newly Unemployed Look For Coverage
REAL,Do I Have COVID-19? Doctors? Free Tools May Tell
REAL,Key Drugs Join PPEs on List of Front-Line Shortages
REAL,Scammers Taking Advantage of N95 Mask Shoratge
REAL,"82,000 Health Care Workers Volunteer for New York"
REAL,Test for Coronavirus Antibodies Approved by FDA
REAL,FDA OKs 1st Stem Cell Human Trial for COVID-19
REAL,Study: If We Use Masks COVID Deaths Could Fall 10%
REAL,"Worldwide, People Clapping for Hospital Workers"
REAL,NYC Ambulances Won't Take Cardiac Arrest Patients
REAL,COMMENTARY: COVID-19 Diary Day 1: Something Wicked This Way Comes
REAL,COMMENTARY: Colorectal Cancer: Proposed Treatment Guidelines for the COVID-19 Era
REAL,"The Week That Wasn't in COVID-19: Elon Musk, 'Pandemic' Scientist"
REAL,First Case of Encephalitis Linked to COVID-19 Reported
REAL,Patients on Steroids With COVID-19 Might Need Rescue Steroids
REAL,COMMENTARY: Iranian Doctors 'Dance' to Defy Coronavirus
REAL,Hard Truths From Infectious Disease Specialists
REAL,COMMENTARY: Nephrologist #COVIDWarrior: 'We Are Winning Some of These Battles'
REAL,Harsh Spring Allergy Season Spurs Hay Fever Fears
REAL,"COVID-19 Daily: Encephalitis Case Report, Silent Spreaders"
REAL,VOYAGER PAD: Clopidogrel Adds No Benefit to Rivaroxaban+Aspirin
REAL,Worldwide Number of COVID-19 Cases Over 1 Million
REAL,Stroke Drug Could Help COVID-19 Patients
REAL,CDC: Separate Moms With Coronavirus From Newborns
REAL,"Shortages Looming for Respirators, Masks, Gowns"
REAL,"Man Recovers from COVID-19, Leaves Sweet Thanks"
REAL,VA Health System Swamped by Coronavirus Patients
REAL,"Zuckerberg, Gates Give Millions to COVID-19 Fight"
REAL,Respirator Masks - In Short Supply
REAL,"COVID-19 Daily: A Hospitalist's Advice, Fighting an 'Infodemic'"
REAL,FDA Face Mask and Respirator Policy in COVID-19 (2020)
REAL,COVID-19: Is Primary Care Ready to Switch to Telemedicine?
REAL,"The Week That Wasn't in COVID-19: 17 Days, Peak in 3 Weeks, Croc"
REAL,Hospitals Face Cash Crunch in 60-90 Days Due to COVID-19: Report
REAL,COVID-19 and the Science of Social Distancing
REAL,Medical Meetings May Be Forever Changed
REAL,Trending Clinical Topic: Social Distancing
REAL,COVID-19 'Infodemic': Researchers Step Up to Stop the Spread
REAL,"New Guidance on Early Med School Graduation Amid COVID-19, LCME Says"
REAL,What Coronavirus Precautions Do You Really Need?
REAL,Researchers Develop COVID-19 Antibody Test
REAL,Fauci: Don't Count on Summer Driving Virus Away
REAL,U.S. Now Leads World in Coronavirus Cases
REAL,Measuring Social Distancing to Slow COVID-19
REAL,"Cough, Fever, Fatigue? Head to CDC's Online Coronavirus Symptom Checker"
REAL,Three Countries Have Kept Coronavirus in Check; Here's How They Did It
REAL,Teachers Cheer Students Amid Coronavirus Lockdown
REAL,Why Germany Has Fewer COVID Deaths Than Neighbors
REAL,"Dr. Anthony Fauci Threatened, Gets Security Boost"
REAL,Federal Inmates Kept in Cells Due to Coronavirus
REAL,"In Some Cases, COVID-19 May Harm the Brain"
REAL,Another COVID-19 Vaccine Being Tested in Mice
REAL,Grandpa?s Social Distance Dance-Off a Treat
REAL,A Decade of Telemedicine Policy Has Advanced in Just 2 Weeks
REAL,COMMENTARY: NYU Med Student Joins COVID Fight: 'Time to Step Up'
REAL,No Staff COVID-19 Diagnoses After Plan at Chinese Cancer Center
REAL,COVID-19: Mental Health Pros Come to the Aid of Frontline Comrades
REAL,Financial Toxicity Is Common With Gynecologic Cancers
REAL,Hydroxychloroquine: Possible COVID Drug Can Be Toxic to Retinas
REAL,Trump: No Mask? Try Scarf for COVID-19 Protection
REAL,Diabetes and Other Conditions Raise COVID-19 Risk
REAL,U.S. Has Deadliest Day As Trump Warns About Future
REAL,Frieden Calls Pandemic Battle ?World War C?
REAL,Heart Patients Need to Be Wary of Coronavirus
REAL,'Pink Eye' Often a Symptom of COVID-19
REAL,Medical Helpline Calls Soar as COVID-19 Spreads
REAL,CNN?s Chris Cuomo Diagnosed With COVID-19
REAL,32 States Have Issued Stay-at-Home Orders
REAL,Dolly Parton Comforts Kids Amid Pandemic
REAL,Coronavirus on Fabric: What You Should Know
REAL,COVID-19 Deaths in Italy a Lesson for the US
REAL,Mild COVID-19 Often Only Shows Gastro Symptoms
REAL,Man Dies After Taking Chloroquine for Coronavirus
REAL,COVID-19 Shifts Telehealth to the Center of Cardiology
REAL,ICU Lessons on COVID-19 From Italian Front Line: Be Flexible
REAL,Week-Old COVID-19 Urology Guidelines Already Outdated
REAL,Health Workers Get Creative With Protective Gear
REAL,Multi-Level Distancing Is Best Against COVID-19: Study
REAL,"COVID-19 Daily: Lung Ultrasound Triage, Telemedicine Guide"
REAL,COVID-19: Medical Students Await Emergency Arrangements
REAL,"COVID-19 Guidance for Ophthalmologists (AAO, 2020)"
REAL,"SCAI Goes Virtual, EAS Postponed, EuroPCR Holds On Amid COVID-19"
REAL,Trump: Social Distancing Efforts Won?t Last Months
REAL,"The Other Side of COVID-19: Milder Cases, Recovery"
REAL,Coping With Cancer During the COVID-19 Pandemic
REAL,Experts Sort Fact From Fiction on COVID-19 Myths
REAL,2020 Olympics Unlikely to Start in July
REAL,CDC Coronavirus Testing Decision To Haunt Nation
REAL,FDA Warns to Watch for Fake COVID-19 Tests
REAL,U.S. Nurses Facing Severe Stress Over Coronavirus
REAL,New Test Will Give COVID-19 Results in 45 Minutes
REAL,Celebrating Grandma's 95th From a Social Distance
REAL,Getting Non-Coronavirus Care a Complicated Effort
REAL,New York Orders Hospitals to Increase Capacity
REAL,National Guard Mobilized to Help Hard-Hit States
REAL,Food Banks Facing Shortages Due to Coronavirus
REAL,7 Tips for Running Your Practice in the Coronavirus Crisis
REAL,Abortion Access Shifting in Some States Amid COVID-19
REAL,COMMENTARY: Advice for Lessening Your Pandemic Anxiety
REAL,Top 10 Tips for Diabetes Telehealth Prophetic in Face of COVID-19
REAL,Trump Details Machine to Decontaminate N95 Masks
REAL,What To Know If Your Surgery Has Been Put on Hold
REAL,FDA OKs Ventilator Sharing
REAL,Johnson & Johnson to Test COVID Vaccine Candidate
REAL,Companies Offer Freebies to Health Care Workers
REAL,Evidence COVID Survivors' Blood May Help Very Ill
REAL,AI Might Spot At-Risk COVID-19 Patients
REAL,"Researchers Find Way to Clean, Re-Use N95 Masks"
REAL,66 Coronavirus Cases in Maryland Nursing Home
REAL,U.S. Army Opens Field Hospital in New York City
REAL,Stars Perform Benefit Coronavirus Concert at Home
REAL,Grandparents 'Grounded' From COVID-19 Crave Contact
REAL,N95 Face Masks Could Be Sterilized and Re-Used
REAL,"Too Many Patients, Too Few Ventilators: How U.S. Hospitals Cope With COVID-19"
REAL,What If a COVID-19 Test Is Negative?
REAL,Topol: US Betrays Healthcare Workers in Coronavirus Disaster
REAL,CMS to Front Medicare Payments to Physicians for 3 Months
REAL,COVID-19: More Hydroxychloroquine Data From France
REAL,"Guidance on Obstetric COVID-19 (ISUOG, 2020)"
REAL,More Than 60 Doctors in Italy Have Died in COVID-19 Pandemic
REAL,Control of COVID-19 in Nursing Homes Guidelines (2020)
REAL,Coding for Coronavirus: NEW Guidance Replaces Rule of 1 Month Ago
REAL,"Social Distancing May Be Working, New Study Hints"
REAL,Coronavirus Similar to One Found in Pangolins
REAL,Critics Lead Gilead to Drop Coronavirus Drug Status
REAL,COVID-19 Likely Seasonal
REAL,Young People Far From Immune to Coronavirus' Bite
REAL,Severe COVID-19 Might Injure the Heart
REAL,"COVID-19: 'Striking' Rates of Anxiety, Depression in HCPs"
REAL,"Novel Coronavirus May Be Transmitted via FMT, FDA Warns"
REAL,COVID-19: Dramatic Changes to Telepsychiatry Rules and Regs
REAL,Commentary: What Neurologists Can Expect From COVID-19
REAL,Guidelines on Delaying Cancer Surgery During COVID-19
REAL,Keep Calm: Under 25s With Diabetes Not Hospitalized Due to COVID-19
REAL,"Amid PPE Shortage, Clinicians Face Harassment, Firing for Self-Care"
REAL,Team Doctors Jump In After Professional Athletes Benched
REAL,Commentary: Lessons on COVID-19 From Low-Income Countries
REAL,"Current US Visa Rules Restrict, Limit COVID-19 Physician Pool"
REAL,Rapid COVID-19 Clinical Practice Guidelines (2020)
REAL,NYC Hospitals Struggle with Coronavirus Surge
REAL,Commentary: Cardiology in the Time of COVID-19
REAL,"COVID-19 Daily: Ground Zero Hospital, PPE Fights"
REAL,FDA Clears Ozanimod (Zeposia) for MS; COVID-19 Delays Launch
REAL,"Hospital Hacks for COVID-19 Shortages Come With Promise, Warnings"
REAL,"AHA Guidance for CPR, Emergency CV Care Amid COVID-19"
REAL,"COVID-19 Daily: Hospital Hacks, Tips for Small Practices"
REAL,AAO Urges Ophthalmologists to Provide Emergency Care Only
REAL,"Guidelines for Evaluating and Testing Persons Under Investigation for COVID-19 (CDC, 2020)"
REAL,"Cancer Care and COVID-19 in Seattle, the First US Epicenter"
REAL,State Lines Erased for Doctors During COVID-19
REAL,Commentary: What If There Is a Virtual ACC and Nobody Cares?
REAL,NYU Med School Offers Early Graduation for Help With COVID-19
REAL,"Cardiac Injury Common in COVID-19, Predicts Mortality"
REAL,Commentary: How to Start Doing Telemedicine Now (In the COVID-19 Crisis)
REAL,Scientists Track Genetic Changes of Coronavirus
REAL,U.S. Marks Deadliest Day of Coronavirus Crisis
REAL,Fauci on Easter Re-Opening: 'Be Very Flexible'
REAL,What People With Parkinson's Need to Know About COVID-19
REAL,"COVID-19 Likely Worse for Vapers, Smokers"
REAL,How to Weather Social Isolation
REAL,Do All Seniors Need Same Coronavirus Precautions?
REAL,Couple Donates Flowers as Pandemic Halts Wedding
REAL,FDA Approved Drugs Show Promise Against COVID-19
REAL,Florida Students Bring COVID Back from Spring Break
REAL,Potential Coronavirus Drugs Already in Low Supply
REAL,U.S. Hospital Beds Were Maxed Out Before Pandemic
REAL,Incomplete State COVID-19 Reports Blur The Picture
REAL,Are Vital Home Health Workers Now A Safety Threat?
REAL,Sidewalk Chalk Used to Spread Joy Amid Pandemic
REAL,Could Robots Be Deployed in Battle With COVID-19?
REAL,COVID-19 May Delay Some Cancer Treatments
REAL,Lawmakers Reach Deal on Coronavirus Relief Package
REAL,COVID-19 Cases in New York Are Surging
REAL,FDA Eases Blood Plasma Treatment Rule for COVID
REAL,Medical Glove Makers Working With Half Their Staff
REAL,Amazon Suspends Accounts for Price Gouging
REAL,COVID-19 and Angiotensin Drugs: Help or Harm?
REAL,"COVID-19: Mitigating Loneliness, Anxiety in Seniors"
REAL,"Guidance on Cardiac Implications of COVID-19 (ACC, 2020)"
REAL,"COVID-19 Daily: Physician Gag Orders, 'Coronavirus Party'"
REAL,Commentary: Pandemic Foreshadows Crisis in Mental Health Services
REAL,Coronavirus: Is It Safe to Get Deliveries?
REAL,Social Distancing May Need to Last Months: Study
REAL,A Wuhan Doctor on the Front Lines: 'Fear to the First Degree'
REAL,"Managing Children's Fear, Anxiety in the Age of COVID-19"
REAL,Early GI Symptoms in COVID-19 May Indicate Fecal Transmission
REAL,Scientists Seek Answers to Hypertension-COVID-19 Link
REAL,COVID-19: Who's Protecting the Protectors?
REAL,Lack of Paid Sick Leave a Coronavirus Threat
REAL,COVID-19 Symptoms
REAL,Some Could Show COVID-19 Symptoms After Quarantine
REAL,Spread of Coronavirus Cancels Travel and Events
REAL,Commentary: Eyewitness: Shanghai Life in the Shadow of COVID-19
REAL,Endocrine Society Meeting Canceled Because of Novel Coronavirus
REAL,ACC Cancels Scientific Sessions Over Novel Coronavirus
REAL,European Heart Rhythm Association Cancels March Congress
REAL,More Medical Conferences Fall to Coronavirus
REAL,CROI Goes Digital After COVID-19 Cases Rise in Boston
REAL,Risk Factors for Death From COVID-19 Identified
REAL,Standard Methods Rid Hospital Rooms of Coronavirus
REAL,Hand-Washing to Prevent Coronavirus Spread
REAL,Antiviral Drug Combo Ineffective Vs. Coronavirus
REAL,Hong Kong Has Spike in Coronavirus Cases
REAL,Calming Your Child's Coronavirus Fears
REAL,Coronavirus Crisis Should Delay Elective Surgeries
REAL,Digestive Symptoms Tied to Worse COVID-19 Outcomes
REAL,Funeral Homes Ponder Deaths In The Age Of COVID-19
REAL,Man Serenades Seniors During Coronavirus Lockdown
REAL,"Record High Flu Hospitalization Rates for Young Kids, Young Adults"
REAL,"COVID-19: ACC Cautions on Troponin, Natriuretic Peptide Tests"
REAL,ID Specialist Diagnosed With COVID-19 in 'Ironic Twist'
REAL,"COVID-19 Daily: ID Doc Tests Positive, Young Adults Hit Hard"
REAL,'Larger Than Life' Physician Stephen Schwartz Dies of COVID-19
REAL,20% of US COVID-19 Deaths Were Young Adults
REAL,About Half of COVID-19 Cases Show Digestive Signs
REAL,New China Report Sets COVID-19 Death Rate at 1.4%
REAL,Coronavirus Drives Island City to Shelter in Place
REAL,Two Members of Congress Diagnosed With Coronavirus
REAL,Stores Offer Special Hours for Seniors
REAL,"Coronavirus Striking Plenty of Young People, Too"
REAL,Healthy Living at Home to Ward Off Coronavirus
REAL,What to Know About Coronavirus If You Have Asthma
REAL,Trump Signs Relief Package Into Law
REAL,Coronavirus and NSAIDs: What Experts Say
REAL,Coronavirus Ravages New Orleans Retirement Home
REAL,Medicare Expands Telemedicine During Pandemic
REAL,Small Study Analyzes Italy Coronavirus Deaths
REAL,Coronavirus News: Italy Now Leads The World In Coronavirus Deaths
REAL,States Tighten Restrictions as Coronavirus Rages
REAL,COVID-19 and Kindness is Trending
REAL,"Coronavirus Daily Digest: April 13, 2020"
REAL,"Coronavirus Daily Digest: April 14, 2020"
REAL,"Coronavirus Daily Digest: April 15, 2020"
REAL,"Coronavirus Daily Digest: April 16, 2020"
REAL,"Coronavirus Daily Digest: March 30, 2020"
REAL,"Coronavirus Daily Digest: April 10, 2020"
REAL,"Coronavirus Daily Digest: April 3, 2020"
REAL,"Coronavirus Daily Digest: April 8, 2020"
REAL,"Coronavirus Daily Digest: April 7, 2020"
REAL,"Coronavirus Daily Digest: March 31, 2020"
REAL,"Coronavirus Daily Digest: March 23, 2020"
REAL,"Coronavirus Daily Digest: March 24, 2020"
REAL,"Coronavirus Daily Digest: April 1, 2020"
REAL,"Coronavirus Daily Digest: March 27, 2020"
REAL,"Coronavirus Daily Digest: April 6, 2020"
REAL,"Coronavirus Daily Digest: April 2, 2020"
REAL,"Coronavirus Daily Digest: March 26, 2020"
REAL,"Coronavirus Daily Digest: March 25, 2020"
REAL,"Coronavirus Daily Digest: April 9, 2020"
REAL,"Coronavirus Daily Digest: March 20, 2020"
REAL,Coronavirus: Colleges to Empty Dorms for Patients
REAL,"Coronavirus Daily Digest: April 17, 2020"
REAL,First COVID Deaths in the US Mobilized a Dialysis Network
REAL,COVID-19: GMC Invites More Doctors Back to Work
REAL,"COVID-19 Daily: Topol Laments Betrayal, HCP Couples Prepare"
REAL,"Firings, Furloughs, and Pay Cuts in Advance of COVID-19 Surge"
REAL,Acute Stroke Care During COVID-19: AHA's Emergency Strategy
REAL,COMMENTARY: COVID-19 Diary Day 2: Insomnia -- The Mark of Medical Practice
REAL,Should Docs Stop Providing Routine Care in the Era of COVID-19?
REAL,Doctors Now Can Work Across State Lines in COVID-19 Crisis
REAL,COVID-19 Prompts 'Lifesaving' Policy Change for Opioid Addiction
REAL,"The Science of Handwashing: Rub, Don't Scrub Hands Raw"
REAL,Italian Oncologist's Cautionary Advice on COVID-19 for US Centers
REAL,Kaiser's COVID-19 Chief Shares Surge Strategies
REAL,Mexico Confirms Its First Cases of Coronavirus
REAL,"COVID-19: Centenarian Survives, High-Risk Blood Types"
REAL,DIY Masks for COVID-19
REAL,Trending Clinical Topic: Pandemic
REAL,COVID-19 and PPE: Some of Us Will Die
REAL,DIY Masks: Worth the Risk? Researchers Are Conflicted
REAL,Radiology Must Adapt to New Pandemic
REAL,EMA Says Stay on Angiotensin Drugs During COVID-19 Pandemic
REAL,High Anxiety in America Over COVID-19
REAL,Blood Type May Affect COVID-19 Risk
REAL,Canceled Blood Drives Lead to ?Severe? Shortage
REAL,Home Test Kits for COVID-19 May Be Available Soon
REAL,Flu Drug Works Vs. Coronavirus: Chinese Study
REAL,"New Coronavirus Wasn't Made in a Lab, Genomic Study Shows"
REAL,Obesity Might Be 'Contagious' Among Teens
REAL,Disruptive School Closings Raise Questions of Equity
REAL,U.S. May Not Have Enough Ventilators for COVID-19
REAL,COVID-19: Could Hydroxychloroquine Really Be the Answer?
REAL,Commentary: Physicians and Health Systems Can Reduce Fear Around COVID-19
REAL,Clinicians Petition Government for National Quarantine
REAL,Two Emergency Physicians Remain in Critical Condition From COVID-19
REAL,Who's Most at Risk From Coronavirus?
REAL,The Most Effective Ways to Kill Coronavirus in Your Home
REAL,Mild Cases May Be Driving Coronavirus Spread
REAL,Novel Coronavirus: Study Suggests Multiple Shedding Routes
REAL,"Novel Coronavirus a 'Tremendous Public Health Threat,' CDC Says"
REAL,Trending Clinical Topic: COVID-19
REAL,Could Climate Change Make Flu Seasons Worse?
REAL,Silent COVID-19 Cases May Stymie Screening Efforts
REAL,Have the Public Health Restrictions Gone Too Far for COVID-19?
REAL,Doctors Look to Existing Drugs in Coronavirus Fight
REAL,"Is It Flu, Or Flu-Like? It's Miserable Either Way"
REAL,New Coronavirus May be Cause of Outbreak in China
REAL,This Year's Flu Season Taking Deadly Aim at Kids
REAL,First U.S. Case of China Coronavirus Diagnosed
REAL,Deadly New Coronavirus Can Spread Between Humans
REAL,Could Your Fitbit Help Detect the Flu?
REAL,CDC to Screen for Novel Coronavirus at Three US Airports
REAL,"Flu Shot No Match for 'B' Strain, Season Rages On"
REAL,Coronavirus Rumor Mill Rampant With Bogus News
REAL,Man Fights to Get Family Out of China Amid Outbreak
REAL,Coronavirus Is Bad but US Flu's New Numbers Still Far Worse
REAL,CDC Confirms Second U.S. Coronavirus Case
REAL,Washington Monitors Coronavirus Patient?s Contacts
REAL,Coronavirus News: What's Happening with the COVID-19 2020 Outbreak
REAL,3 U.S. Airports to Screen for Chinese Coronavirus
REAL,Mystery Coronavirus from China: What to Know
REAL,Hashtag Medicine: Coronavirus Fear Goes Viral on Social Media
REAL,First Spread of Coronavirus in U.S. Confirmed
REAL,Commentary: Novel Coronavirus (2019-nCoV): FAQs for Clinicians
REAL,Many Child Care Centers Don't Require Flu Shots
REAL,COVID-19 Forecasts for the United States
REAL,COVID-19 Travel Recommendations by Country
REAL,Coronavirus and Travel in the United States
REAL,U.S. Clinical Laboratories Reporting SARS-CoV-2 Test Results to CDC
REAL,COVIDView Weekly Summary
REAL,Testing for COVID-19
REAL,Coronavirus Disease 2019 (COVID-19)-Associated Hospitalization Surveillance Network (COVID-NET)
REAL,COVID-19 Considerations for Cleaner Air Shelters and Cleaner Air Spaces to Protect the Public from Wildfire Smoke
REAL,Videos
REAL,Coronavirus Disease 2019 (COVID-19)
REAL,Resources for Community and Faith-Based Leaders
REAL,Downloadable Videos
REAL,Environmental Health Practitioners
REAL,Data Visualization
REAL,Frequently Asked Questions on COVID-19 Testing at Laboratories
REAL,Previous COVID-19 Forecasts
REAL,U.S. Outpatient Influenza-like Illness Surveillance Network (ILINet): Overall Percentage of Visits for ILI
REAL,NCHS Mortality Surveillance Data
REAL,Emergency Department Visits Percentage of Visits for COVID-19-Like Illness (CLI) or Influenza-like Illness (ILI)
REAL,Percentage of Visits for ILI by Age Group Reported by A Subset of ILINet Providers
REAL,U.S. State and Local Public Health Laboratories Reporting to CDC
REAL,Commercial Labs
REAL,Responder Stories
REAL,CDC shares 9 tons of protective gear with responders
REAL,Operational Considerations for Personal Protective Equipment in the Context of Global Supply Shortages for Coronavirus Disease 2019 (COVID-19) Pandemic: non-US Healthcare Settings
REAL,Communication Resources for Travelers
REAL,Ten Clinical Tips on COVID-19 for Healthcare Providers Involved in Patient Care
REAL,First Responders and Law Enforcement
REAL,Transportation and Delivery
REAL,Communication Resources
REAL,Contact Tracing
REAL,Cases & Latest Updates
REAL,Strategies for Optimizing the Supply of Disposable Medical Gloves
REAL,If You Have Pets
REAL,Animals and Coronavirus Disease 2019 (COVID-19)
REAL,Resources for Correctional and Detention Facilities
REAL,What School Nutrition Professionals and Volunteers at Schools Need to Know about COVID-19
REAL,Testing for Coronavirus (COVID-19) in Nursing Homes
REAL,Responding to Coronavirus (COVID-19) in Nursing Homes
REAL,Clinical Care Guidance for Healthcare Professionals about Coronavirus (COVID-19)
REAL,COVID-19 By the Numbers
REAL,Decontamination and Reuse of Filtering Facepiece Respirators using Contingency and Crisis Capacity Strategies
REAL,Mitigate Healthcare Personnel Staffing Shortages
REAL,Criteria for Return to Work for Healthcare Personnel with Confirmed or Suspected COVID-19 (Interim Guidance)
REAL,Social Media Toolkit
REAL,"Reopening Guidance for Cleaning and Disinfecting Public Spaces, Workplaces, Businesses, Schools, and Homes"
REAL,Contact Tracing : Part of a Multipronged Approach to Fight the COVID-19 Pandemic
REAL,Caring for someone at home
REAL,"Interim Guidelines for Collecting, Handling, and Testing Clinical Specimens from Persons for Coronavirus Disease 2019 (COVID-19)"
REAL,Communication Toolkit for Airlines to inform Travelers and Crew
REAL,Healthcare Provider and Facility Guidance for Non-US Settings
REAL,Cases in U.S.
REAL,People Who Need to Take Extra Precautions
REAL,Communication Toolkit for Transportation Partners to Inform Road Travelers
REAL,Care for Breastfeeding Women
REAL,Key Resources
REAL,COVID-19 Serology Surveillance Strategy
REAL,Additional Training Objectives
REAL,COVID-19 Contact Tracing Training Guidance and Resources
REAL,Identify Strategies to Reduce Spread of COVID-19
REAL,Children and Coronavirus Disease 2019 (COVID-19): Tips to keep children healthy while school?s out
REAL,"Support for States, Tribes, Localities and Territories"
REAL,Testing
REAL,What To Do if You Are Sick
REAL,Environmental Cleaning and Disinfection Recommendations
REAL,Cleaning and Disinfecting Your Facility
REAL,Guidance for U.S. Healthcare Facilities about Coronavirus (COVID-19)
REAL,Frequently Asked Questions and Answers: Coronavirus Disease-2019 (COVID-19) and Children
REAL,Test for Current Infection
REAL,Antibody Testing
REAL,"COVID-19 Staffing Guidance for State, Tribal, Local, and Territorial Health Departments"
REAL,Global COVID-19
REAL,Symptoms
REAL,Living in Shared Housing
REAL,Travel: Frequently Asked Questions and Answers
REAL,Key Strategies to Prepare for COVID-19 in Long-term Care Facilities (LTCFs)
REAL,Laboratory Capacity
REAL,Dental Settings
REAL,FAQs for Law Enforcement Agencies and Personnel
REAL,Global case numbers are reported by the World Health Organization (WHO)
REAL,Evaluating and Reporting Persons Under Investigation (PUI)
REAL,Meat and Poultry Processing Workers and Employers
REAL,Information for Clinicians on Therapeutic Options for COVID-19 Patients
REAL,COVID-19 Guidance for Shared or Congregate Housing
REAL,Cases & Deaths by County
REAL,Public Service Announcements (PSAs)
REAL,COVID-19 Buttons and Badges
REAL,U.S. Outpatient Influenza-like Illness Surveillance Network (ILINet): Overall Percentage of Visits for ILI
REAL,NCHS Mortality Surveillance Data
REAL,How to Protect Yourself
REAL,U.S. Clinical Laboratories Reporting SARS-CoV-2 Test Results to CDC
REAL,Commercial Labs
REAL,Emergency Department Visits Percentage of Visits for COVID-19-Like Illness (CLI) or Influenza-like Illness (ILI)
REAL,Percentage of Visits for ILI by Age Group Reported by A Subset of ILINet Providers
REAL,U.S. State and Local Public Health Laboratories Reporting to CDC
REAL,COVIDView Summary ending on April 18
